{
  "schema_version": "1.0",
  "metadata": {
    "author": "OrderPilot-AI",
    "created_at": "2026-01-18T03:00:00Z",
    "tags": ["template", "minimal", "example"],
    "notes": "Minimal working example for Regime-Based JSON Strategy System"
  },
  "indicators": [
    {
      "id": "rsi14_1h",
      "type": "RSI",
      "params": {"period": 14},
      "timeframe": "1h"
    },
    {
      "id": "adx14_1h",
      "type": "ADX",
      "params": {"period": 14},
      "timeframe": "1h"
    }
  ],
  "regimes": [
    {
      "id": "trending",
      "name": "Trending Market",
      "conditions": {
        "all": [
          {
            "left": {"indicator_id": "adx14_1h", "field": "value"},
            "op": "gt",
            "right": {"value": 25}
          }
        ]
      },
      "priority": 10
    },
    {
      "id": "range",
      "name": "Range-Bound Market",
      "conditions": {
        "all": [
          {
            "left": {"indicator_id": "adx14_1h", "field": "value"},
            "op": "lt",
            "right": {"value": 20}
          }
        ]
      },
      "priority": 5
    }
  ],
  "strategies": [
    {
      "id": "trend_follow",
      "name": "Trend Following",
      "entry": {
        "all": [
          {
            "left": {"indicator_id": "adx14_1h", "field": "value"},
            "op": "gt",
            "right": {"value": 25}
          },
          {
            "left": {"indicator_id": "rsi14_1h", "field": "value"},
            "op": "gt",
            "right": {"value": 60}
          }
        ]
      },
      "exit": {
        "any": [
          {
            "left": {"indicator_id": "adx14_1h", "field": "value"},
            "op": "lt",
            "right": {"value": 20}
          },
          {
            "left": {"indicator_id": "rsi14_1h", "field": "value"},
            "op": "lt",
            "right": {"value": 40}
          }
        ]
      },
      "risk": {
        "stop_loss_pct": 2.0,
        "take_profit_pct": 5.0,
        "trailing_mode": "atr",
        "trailing_multiplier": 2.0
      }
    },
    {
      "id": "mean_reversion",
      "name": "Mean Reversion",
      "entry": {
        "any": [
          {
            "left": {"indicator_id": "rsi14_1h", "field": "value"},
            "op": "lt",
            "right": {"value": 30}
          },
          {
            "left": {"indicator_id": "rsi14_1h", "field": "value"},
            "op": "gt",
            "right": {"value": 70}
          }
        ]
      },
      "exit": {
        "all": [
          {
            "left": {"indicator_id": "rsi14_1h", "field": "value"},
            "op": "between",
            "right": {"min": 45, "max": 55}
          }
        ]
      },
      "risk": {
        "stop_loss_pct": 1.5,
        "take_profit_pct": 3.0
      }
    }
  ],
  "strategy_sets": [
    {
      "id": "set_trend",
      "name": "Trending Strategies",
      "strategies": [
        {
          "strategy_id": "trend_follow"
        }
      ]
    },
    {
      "id": "set_range",
      "name": "Range Strategies",
      "strategies": [
        {
          "strategy_id": "mean_reversion"
        }
      ]
    }
  ],
  "routing": [
    {
      "strategy_set_id": "set_trend",
      "match": {
        "all_of": ["trending"]
      }
    },
    {
      "strategy_set_id": "set_range",
      "match": {
        "all_of": ["range"]
      }
    }
  ]
}
