{
  "schema_version": "1.0.0",
  "indicators": [
    {
      "id": "bbands20_width",
      "type": "BBANDS",
      "params": {
        "period": 20,
        "std": 2
      }
    },
    {
      "id": "bbands20_middle",
      "type": "BBANDS",
      "params": {
        "period": 20,
        "std": 2
      }
    },
    {
      "id": "volume",
      "type": "Volume",
      "params": {
        "window": 20
      }
    },
    {
      "id": "macd12_26_9",
      "type": "MACD",
      "params": {
        "fast": 12,
        "slow": 26,
        "signal": 9
      }
    }
  ],
  "regimes": [
    {
      "id": "breakout_regime",
      "name": "Breakout Market",
      "conditions": {
        "all": [
          {
            "left": {
              "indicator_id": "bb20",
              "field": "width"
            },
            "op": "gt",
            "right": {
              "value": 0.0
            }
          },
          {
            "left": {
              "indicator_id": "adx14",
              "field": "value"
            },
            "op": "gt",
            "right": {
              "value": 20.0
            }
          }
        ]
      },
      "priority": 10,
      "scope": "entry"
    }
  ],
  "strategies": [
    {
      "id": "breakout_volatility",
      "name": "breakout_volatility",
      "entry": {
        "all": [
          {
            "left": {
              "indicator_id": "bb20",
              "field": "width"
            },
            "op": "gt",
            "right": {
              "value": 0.0
            }
          },
          {
            "left": {
              "indicator_id": "adx14",
              "field": "value"
            },
            "op": "gt",
            "right": {
              "value": 20.0
            }
          }
        ]
      },
      "exit": {
        "any": [
          {
            "left": {
              "indicator_id": "adx14",
              "field": "value"
            },
            "op": "lt",
            "right": {
              "value": 20.0
            }
          }
        ]
      },
      "risk": {
        "position_size": 0.02,
        "stop_loss": 0.02,
        "take_profit": 0.06
      }
    }
  ],
  "strategy_sets": [
    {
      "id": "set_breakout_volatility",
      "name": "breakout_volatility Set",
      "strategies": [
        {
          "strategy_id": "breakout_volatility"
        }
      ]
    }
  ],
  "routing": [
    {
      "strategy_set_id": "set_breakout_volatility",
      "match": {
        "all_of": [
          "breakout_regime"
        ]
      }
    }
  ]
}
