{
  "schema_version": "1.0",
  "metadata": {
    "author": "Test Suite",
    "created_at": "2026-01-18T03:00:00Z",
    "tags": ["test", "minimal"],
    "notes": "Minimal valid config for unit tests"
  },
  "indicators": [
    {
      "id": "rsi14",
      "type": "RSI",
      "params": {"period": 14}
    }
  ],
  "regimes": [
    {
      "id": "trending",
      "name": "Trending Market",
      "conditions": {
        "all": [
          {
            "left": {"indicator_id": "rsi14", "field": "value"},
            "op": "gt",
            "right": {"value": 60}
          }
        ]
      }
    }
  ],
  "strategies": [
    {
      "id": "trend_follow",
      "name": "Trend Following",
      "entry": {
        "all": [
          {
            "left": {"indicator_id": "rsi14", "field": "value"},
            "op": "gt",
            "right": {"value": 60}
          }
        ]
      },
      "risk": {
        "stop_loss_pct": 2.0,
        "take_profit_pct": 5.0
      }
    }
  ],
  "strategy_sets": [
    {
      "id": "set_trend",
      "name": "Trending Strategies",
      "strategies": [
        {
          "strategy_id": "trend_follow"
        }
      ]
    }
  ],
  "routing": [
    {
      "strategy_set_id": "set_trend",
      "match": {
        "all_of": ["trending"]
      }
    }
  ]
}
