{
  "schema_version": "1.0.0",
  "indicators": [
    {
      "id": "bbands20_middle",
      "type": "BBANDS",
      "params": {
        "period": 20,
        "std": 2
      }
    },
    {
      "id": "rsi14",
      "type": "RSI",
      "params": {
        "period": 14
      }
    },
    {
      "id": "adx14",
      "type": "ADX",
      "params": {
        "period": 14
      }
    },
    {
      "id": "stoch14_k",
      "type": "STOCH",
      "params": {
        "k_period": 14,
        "d_period": 3
      }
    }
  ],
  "regimes": [
    {
      "id": "mean_reversion_regime",
      "name": "Mean Reversion Market",
      "conditions": {
        "all": [
          {
            "left": {
              "indicator_id": "bbands20_middle",
              "field": "value"
            },
            "op": "gt",
            "right": {
              "value": 0.05
            }
          },
          {
            "left": {
              "indicator_id": "rsi14",
              "field": "value"
            },
            "op": "gt",
            "right": {
              "value": 30.0
            }
          },
          {
            "left": {
              "indicator_id": "adx14",
              "field": "value"
            },
            "op": "lt",
            "right": {
              "value": 25.0
            }
          },
          {
            "left": {
              "indicator_id": "stoch14_k",
              "field": "value"
            },
            "op": "gt",
            "right": {
              "value": 20.0
            }
          }
        ]
      },
      "priority": 10,
      "scope": "entry"
    }
  ],
  "strategies": [
    {
      "id": "mean_reversion_bb",
      "name": "mean_reversion_bb",
      "entry": {
        "all": [
          {
            "left": {
              "indicator_id": "bbands20_middle",
              "field": "value"
            },
            "op": "gt",
            "right": {
              "value": 0.05
            }
          },
          {
            "left": {
              "indicator_id": "rsi14",
              "field": "value"
            },
            "op": "gt",
            "right": {
              "value": 30.0
            }
          },
          {
            "left": {
              "indicator_id": "adx14",
              "field": "value"
            },
            "op": "lt",
            "right": {
              "value": 25.0
            }
          },
          {
            "left": {
              "indicator_id": "stoch14_k",
              "field": "value"
            },
            "op": "gt",
            "right": {
              "value": 20.0
            }
          }
        ]
      },
      "exit": {
        "all": [
          {
            "left": {
              "indicator_id": "bbands20_middle",
              "field": "value"
            },
            "op": "lt",
            "right": {
              "value": 0.0
            }
          },
          {
            "left": {
              "indicator_id": "rsi14",
              "field": "value"
            },
            "op": "lt",
            "right": {
              "value": 0.0
            }
          }
        ]
      },
      "risk": {
        "position_size": 0.02,
        "stop_loss": 0.015,
        "take_profit": 0.06
      }
    }
  ],
  "strategy_sets": [
    {
      "id": "set_mean_reversion_bb",
      "name": "mean_reversion_bb Set",
      "strategies": [
        {
          "strategy_id": "mean_reversion_bb"
        }
      ]
    }
  ],
  "routing": [
    {
      "strategy_set_id": "set_mean_reversion_bb",
      "match": {
        "all_of": [
          "mean_reversion_regime"
        ]
      }
    }
  ]
}