{
  "schema_version": "1.0.0",
  "indicators": [
    {
      "id": "rsi14",
      "type": "RSI",
      "params": {
        "period": 14
      }
    },
    {
      "id": "sma20",
      "type": "SMA",
      "params": {
        "period": 20
      }
    },
    {
      "id": "volume",
      "type": "Volume",
      "params": {
        "window": 20
      }
    }
  ],
  "regimes": [
    {
      "id": "mean_reversion_regime",
      "name": "Mean Reversion Market",
      "conditions": {
        "all": [
          {
            "left": {
              "indicator_id": "rsi14",
              "field": "value"
            },
            "op": "gt",
            "right": {
              "value": 25.0
            }
          },
          {
            "left": {
              "indicator_id": "sma20",
              "field": "value"
            },
            "op": "gt",
            "right": {
              "value": 2.0
            }
          },
          {
            "left": {
              "indicator_id": "volume",
              "field": "value"
            },
            "op": "lt",
            "right": {
              "value": 0.8
            }
          }
        ]
      },
      "priority": 10,
      "scope": "entry"
    }
  ],
  "strategies": [
    {
      "id": "mean_reversion_rsi",
      "name": "mean_reversion_rsi",
      "entry": {
        "all": [
          {
            "left": {
              "indicator_id": "rsi14",
              "field": "value"
            },
            "op": "gt",
            "right": {
              "value": 25.0
            }
          },
          {
            "left": {
              "indicator_id": "sma20",
              "field": "value"
            },
            "op": "gt",
            "right": {
              "value": 2.0
            }
          },
          {
            "left": {
              "indicator_id": "volume",
              "field": "value"
            },
            "op": "lt",
            "right": {
              "value": 0.8
            }
          }
        ]
      },
      "exit": {
        "all": [
          {
            "left": {
              "indicator_id": "rsi14",
              "field": "value"
            },
            "op": "lt",
            "right": {
              "value": 0.0
            }
          }
        ]
      },
      "risk": {
        "position_size": 0.02,
        "stop_loss": 0.015,
        "take_profit": 0.06
      }
    }
  ],
  "strategy_sets": [
    {
      "id": "set_mean_reversion_rsi",
      "name": "mean_reversion_rsi Set",
      "strategies": [
        {
          "strategy_id": "mean_reversion_rsi"
        }
      ]
    }
  ],
  "routing": [
    {
      "strategy_set_id": "set_mean_reversion_rsi",
      "match": {
        "all_of": [
          "mean_reversion_regime"
        ]
      }
    }
  ]
}