{
  "schema_version": "1.0.0",
  "indicators": [
    {
      "id": "stoch14_k",
      "type": "STOCH",
      "params": {
        "k_period": 14,
        "d_period": 3
      }
    },
    {
      "id": "bbands20_middle",
      "type": "BBANDS",
      "params": {
        "period": 20,
        "std": 2
      }
    },
    {
      "id": "atr14",
      "type": "ATR",
      "params": {
        "period": 14
      }
    }
  ],
  "regimes": [
    {
      "id": "scalping_regime",
      "name": "Scalping Market",
      "conditions": {
        "all": [
          {
            "left": {
              "indicator_id": "stoch14_k",
              "field": "value"
            },
            "op": "gt",
            "right": {
              "value": 15.0
            }
          },
          {
            "left": {
              "indicator_id": "bbands20_middle",
              "field": "value"
            },
            "op": "gt",
            "right": {
              "value": 0.02
            }
          },
          {
            "left": {
              "indicator_id": "atr14",
              "field": "value"
            },
            "op": "lt",
            "right": {
              "value": 0.8
            }
          }
        ]
      },
      "priority": 10,
      "scope": "entry"
    }
  ],
  "strategies": [
    {
      "id": "scalping_range",
      "name": "scalping_range",
      "entry": {
        "all": [
          {
            "left": {
              "indicator_id": "stoch14_k",
              "field": "value"
            },
            "op": "gt",
            "right": {
              "value": 15.0
            }
          },
          {
            "left": {
              "indicator_id": "bbands20_middle",
              "field": "value"
            },
            "op": "gt",
            "right": {
              "value": 0.02
            }
          },
          {
            "left": {
              "indicator_id": "atr14",
              "field": "value"
            },
            "op": "lt",
            "right": {
              "value": 0.8
            }
          }
        ]
      },
      "exit": {
        "all": [
          {
            "left": {
              "indicator_id": "stoch14_k",
              "field": "value"
            },
            "op": "lt",
            "right": {
              "value": 0.0
            }
          }
        ]
      },
      "risk": {
        "position_size": 0.02,
        "stop_loss": 0.008,
        "take_profit": 0.06
      }
    }
  ],
  "strategy_sets": [
    {
      "id": "set_scalping_range",
      "name": "scalping_range Set",
      "strategies": [
        {
          "strategy_id": "scalping_range"
        }
      ]
    }
  ],
  "routing": [
    {
      "strategy_set_id": "set_scalping_range",
      "match": {
        "all_of": [
          "scalping_regime"
        ]
      }
    }
  ]
}